Name,English,Translation,Restrictions,Comment
StartPage_Web_Available,Available,Available,,Start page status label
StartPage_Web_ViewOnMarketplace,View On Marketplace,View On Marketplace,,Start page tooltip
StartPage_Web_Download,Download,Download,,Start page tooltip
StartPage_Web_Open,Open,Open,,Start page tooltip
StartPage_Web_Remove,Remove Local Files,Remove Local Files,,Start page remove tooltip
RemoteWorker_Submit,Submit,Submit,,Submit remote worker changes
remote_worker_cache_path,Cache Path,Cache Path,,Remote worker cache path
remote_worker_folder_sync_path,Path to FolderSync Tool,Path to FolderSync Tool,,Remote worker foldersync path
remote_worker_fronkensteen_runtime_path,Path to Remote Runtime,Path to Remote Runtime,,Remote worker runtime path
remote_worker_output_path,Output Path,Output Path,,Remote worker output path
remote_worker_project_cache_path,Project Cache Path,Project Cache Path,,Remote worker project cache path
default_audio_setting,Default Audio Device,Default Audio Device,,Default Audio Device setting
Validate_NameLength,Resource name must be between {2} and {1} characters long,Resource name must be between {2} and {1} characters long,,validation error message for resource name
Validate_InvalidFolderName,Folder name contains invalid characters: {0},Folder name contains invalid characters: {0},,validation error message for folder names
DnD_ResourceSelection_DropLabel,Drop here to assign resource,Drop here to assign resource,,DnD™ Resource Input label
TextureGroups_OpenResource,Open,Open,,Open Resource
RemoteWorker_WindowTitle,Settings for {0},Settings for {0},,Remote worker window title
RemoteWorker_PlatformNotSupportedTitle,Remote Worker - Platform Not Supported,Remote Worker - Platform Not Supported,,Platform is not supported on this remote worker title
RemoteWorker_ErrorTitle,Remote Worker Error,Remote Worker Error,,Remote worker error
RemoteWorker_Error_Connect,Failed to connect to the remote worker.\nVerify the host name and try again.,Failed to connect to the remote worker.\nVerify the host name and try again.,,Failed to connect error
RemoteWorker_NameErrorTitle,Remote Worker Name Error,Remote Worker Name Error,,Error with Remote Worker Name
RemoteWorker_NameError,A Remote Worker with this name already exists.,A Remote Worker with this name already exists.,,Remote Worker Name error message
RemoteWorker_PlatformNotSupported,The current platform is not supported on this Remote Worker.,The current platform is not supported on this Remote Worker.,,Platform is not supported on this remote worker
SearchOutput_Default,Press ${open_search_replace} to open the Search and Replace window.,Press ${open_search_replace} to open the Search and Replace window.,,Default text for the Search Output Window
SourceControl_Default,"Source Control Output will go here. If you have not turned on Source Control, you can find it in Main Options.","Source Control Output will go here. If you have not turned on Source Control, you can find it in Main Options.",,Default text for the Source Control Window
SourceControl_Trial,"Source Control Output would go here, but you are currently using a Trial version.\nPlease upgrade to a paid version to enable the Source Control features!\nVisit https://www.yoyogames.com/get2 to view our pricing.","Source Control Output would go here, but you are currently using a Trial version.\nPlease upgrade to a paid version to enable the Source Control features!\nVisit https://www.yoyogames.com/get2 to view our pricing.",,Default text for source control window when in trial mode.
TileSetEditor_WarningRoomTileLayersAffected,"Tile size increase will cause rooms to lose some tile layer data, are you sure you want to make this change?\n\nTo avoid data loss press cancel and increase room size of the affected rooms: {0}","Tile size increase will cause rooms to lose some tile layer data, are you sure you want to make this change?\n\nTo avoid data loss press cancel and increase room size of the affected rooms: {0}",,warning for user when increasing tile width/height which would cause a room tile layer to be truncated and lose painted tiles
GMStdAlpha_Name,Set Draw Alpha,Set Draw Alpha,,dnd set draw alpha node
GMStdAlpha_Desc,Set the alpha channel (0 to 1) used for drawing.,Set the alpha channel (0 to 1) used for drawing.,,dnd set draw alpha node
GMStdGetAlpha_Name,Get Draw Alpha,Get Draw Alpha,,dnd set draw alpha node
GMStdGetAlpha_Desc,Get the alpha channel (0 to 1) used for drawing.,Get the alpha channel (0 to 1) used for drawing.,,dnd set draw alpha node
GMStdUseAlpha,Use Alpha,Use Alpha,,dnd node label
TextEditorPanel_ConvertToDnD,Convert to DnD™,Convert to DnD™,,Convert the current script to DnD™
Marketplace_CreatePackageDetails,Package Details:,Package Details:,,package details heading
Marketplace_InactiveTutorialSettings,Tutorial Content Settings will appear here when 'Tutorial' Package Type has been selected,Tutorial Content Settings will appear here when 'Tutorial' Package Type has been selected,,the message displayed when the tutorial settings are inactive
CloseNonEmptyWorkspaceTabMessage,"Closing this workspace will also close the contained editors, are you sure?","Closing this workspace will also close the contained editors, are you sure?",,confirmation dialog message when closing a workspace tab with open editors
CloseNonEmptyWorkspaceTabTitle,Closing a non-empty workspace,Closing a non-empty workspace,,confirmation dialog title
enableclosetabshortcut,Allow empty tabs to be closed via the keyboard shortcut,Allow empty tabs to be closed via the keyboard shortcut,,close tab label
autoclosenonemptyworkspacetabs,Automatic response to closing a workspace via keyboard shortcut,Automatic response to closing a workspace via keyboard shortcut,,auto close tab label
tileseteditor_automaticaccepttilesize,Automatic response to room tile layer cropping due to tile size changes,Automatic response to room tile layer cropping due to tile size changes,,tile size causing tile layer crop confirmation description
fonteditor_fontnotavailable,Font family '{0}' is not available. Verify that you have installed this font correctly.,Font family '{0}' is not available. Verify that you have installed this font correctly.,,Font editor font not available
fonteditor_fontnotavailable_listbox,Missing '{0}',Missing '{0}',,Text in font dropdown to tell user the font is unavailable
fonteditor_fontnotavailable_title,Unavailable Font,Unavailable Font,,Title for unavailable font warning
TextureAudioGroups_CyclicParent,A group cannot be a child of itself.,A group cannot be a child of itself.,,Cyclic parent warning
TextureAudioGroups_CyclicParent_Title,Invalid Parent,Invalid Parent,,Title for above warning
workspace_background_pref,Restore Default,Restore Default,,Restore default background
IDETooltip_CurrentTarget,Current Build Target,Current Build Target,,tooltip for the current build target info
spriteanimmode,Default sprite animation mode,Default sprite animation mode,,The default animation mode type for new sprites
spriteanimspeed,Default sprite animation speed,Default sprite animation speed,,The default animation speed for new sprites
NewSpriteWidth,Default sprite width,Default sprite width,,pref label
NewSpriteHeight,Default sprite height,Default sprite height,,pref label
TileSetEditorMenu_Delete,Delete,Delete,,the delete animation or auto tile set context menu option
TileSetEditorMenu_Rename,Rename,Rename,,the rename animation or auto tile set context menu option
RoomEditor_NoSelectionPathLayerStatus,"LMB + T to translate path, LMB + R to rotate path, LMB + S to scale path","LMB + T to translate path, LMB + R to rotate path, LMB + S to scale path",,status bar information for editing paths
YYP_DragDrop_Message,Load the project instead of adding a datafile?,Load the project instead of adding a datafile?,,confirm message
YYP_DragDrop_Message_IDE,Load the project?,Load the project?,,confirm message
StartPage_Web_RefreshDemos,Refresh owned demos.,Refresh owned demos.,,Refresh demos start page
YYP_DragDrop_Title,Project file detected,Project file detected,,dialog title
Archive_DragDrop_Message,Import the project instead of adding a datafile?,Import the project instead of adding a datafile?,,confirm message
Archive_DragDrop_Message_IDE,Import the project?,Import the project?,,confirm message
Archive_DragDrop_Title,Project archive detected,Project archive detected,,dialog title
GadgetToolbox_ExpandableCategory,Expandable Category,Expandable Category,,Dialog editor toolbox name
MarketplaceAsset_RemoveTooltip,Delete local content for this asset.,Delete local content for this asset.,,Remove tooltip for marketplace assets
MarketplaceTutorial_DragDrop_Message,Open the tutorial instead of adding a datafile?,Open the tutorial instead of adding a datafile?,,confirm message
MarketplaceTutorial_DragDrop_Message_IDE,Open the tutorial?,Open the tutorial?,,confirm message
MarkerplaceTutorial_DragDrop_Title,Tutorial package detected,Tutorial package detected,,dialog title
MarketplacePackage_DragDrop_Message,Import marketplace package assets instead of adding a datafile?,Import marketplace package assets instead of adding a datafile?,,confirm message
MarketplacePackage_DragDrop_Message_IDE,Import marketplace package?,Import marketplace package?,,confirm message
MarketplacePackage_DragDrop_Title,Marketplace Package Detected,Marketplace Package Detected,,dialog title
Package_DragDrop_Message,Import package assets instead of adding a datafile?,Import package assets instead of adding a datafile?,,confirm message
Package_DragDrop_Message_IDE,Import asset package?,Import asset package?,,confirm message
Package_DragDrop_Title,Asset Package Detected,Asset Package Detected,,dialog title
Dialog_CopyToClipboard,Copy to clipboard,Copy to clipboard,,Copy the dialog message to the clipboard
Marketplace_MyLibrary_Reviews,{0} reviews,{0} reviews,,Review count label
Marketplace_MyLibrary_MadeWith,Created with {0},Created with {0},,Created with asset label
Marketplace_MyLibrary_SearchText,Search...,Search...,,Search default text
Marketplace_MyLibrary_AllCategory,All Assets,All Assets,,Category all assets
Marketplace_MyLibrary_UpdateCategory,New Version ({0}),New Version ({0}),,Category new version available
Marketplace_MyLibrary_ViewAuthor,Visit this author's page.,Visit this author's page.,,Author link text
Marketplace_MyLibrary_ViewReviews,View this asset's reviews.,View this asset's reviews.,,Review link text
Marketplace_MyLibrary_Offline,Offline,Offline,,Offline label
Marketplace_MyLibrary_DeleteContentTitle,Delete Local Content?,Delete Local Content?,,marketplace delete asset warning title
Marketplace_MyLibrary_OfflineDelete,Are you sure you want to delete local content for '{0}'?\nYou will need to be online to download it again.,Are you sure you want to delete local content for '{0}'?\nYou will need to be online to download it again.,,marketplace asset delete offline warning
Marketplace_OfflineDeleteConfirmChoice,Automatic response to offline content delete,Automatic response to offline content delete,,preference choice for marketplace offline local content delete
TileSetEditor_OpenClosedEdge_ToolTip,Open Or Closed Edges,Open Or Closed Edges,,tooltip for the auto tile set option to have open or closed edges
Marketplace_MyLibrary_SearchCaption,Search Results ({0}),Search Results ({0}),,Search caption
StartPage_Web_TooltipNotOwned,Acquire this tutorial,Acquire this tutorial,,Acquire tutorial tooltip
StartPage_Web_TooltipNotOwnedDemo,Acquire this demo,Acquire this demo,,Acquire demo tooltip
StartPage_Web_OwnedTutorialsFiltered,Installed,Installed,,Installed filter text
PhysicsShapeWindow_CurFrame,Frame:,Frame:,,Phsyics shape window toolbar frame label
Validation_ItemFrozen,"Item '{0}' is locked, unlock to allow editing","Item '{0}' is locked, unlock to allow editing",,validation error message when item is locked
Validation_ItemsFrozen,"Items '{0}' are locked, unlock to allow editing","Items '{0}' are locked, unlock to allow editing",,validation error message when multiple items are locked
Validation_LayerFrozen,"Layer '{0}' is locked, unlock to allow editing","Layer '{0}' is locked, unlock to allow editing",,validation error message when layer is locked
Validation_LayersFrozen,"Layers '{0}' are locked, unlock to allow editing","Layers '{0}' are locked, unlock to allow editing",,validation error message when multiple layers are locked
Validation_ItemOwnerLayerFrozen,"Owner layer '{0}' is locked, unlock to allow editing of item","Owner layer '{0}' is locked, unlock to allow editing of item",,validation error message when layer is locked
Validation_ItemOwnerLayersFrozen,"Owner layers '{0}' are locked, unlock to allow editing of items","Owner layers '{0}' are locked, unlock to allow editing of items",,validation error message when layer is locked
room_frozenitemchoice,Automatic response to item locked warning,Automatic response to item locked warning,,preference acceptance or show dialog message for editing locked items
room_frozenlayerchoice,Automatic response to layer locked warning,Automatic response to layer locked warning,,preference acceptance or show dialog message for editing locked layers
room_frozenownerlayerchoice,Automatic response to item owner layer locked warning,Automatic response to item owner layer locked warning,,preference acceptance or show dialog message for editing items within locked layers
TextureAudioGroups_NoneParent,None,None,,No parent
SettingsVertexLimit,Automatic response to exceeding physics vertex limit,Automatic response to exceeding physics vertex limit,,Settings box2d vertex limit
EventInherited_RequireModifierLookup,${ctrl}+MMB to open the inherited event instead of the manual.,${ctrl}+MMB to open the inherited event instead of the manual.,,event_inherited lookup modifier on/off
VertexLimitWarning,A physics shape cannot have more than 8 points.,A physics shape cannot have more than 8 points.,,Vertex limit physics warning message
VertexLimitWarning_Title,Warning,Warning,,Above message title
ObjectEditor_DropParentHere,Drop here to assign parent,Drop here to assign parent,,Drop message for object parent
ObjectEditor_DropChildHere,Drop here to add child,Drop here to add child,,Drop message for object child list
ObjectEditor_AddChildTooltip,Add child,Add child,,Object editor child list add child tooltip
ObjectEditor_RemoveChildTooltip,Remove child,Remove child,,Object editor child list remove child tooltip
INVALID_FILEPATH_TITLE,Invalid Path,Invalid Path,,Invalid File path title
INVALID_FILEPATH_PATHTOOLONG,File path is too long: {0},File path is too long: {0},,File at x has a path which is too long to handle
INVALID_INCLUDEDFILE_NAME_TITLE,Included File has invalid name,Included File has invalid name,,Invalid included file name dialog box title
INVALID_INCLUDEDFILE_NAME_MSG,"One or more included files has an invalid filename, should only contain a-z, A_Z, 0-9, _ or .\nSee the output panel for a list.","One or more included files has an invalid filename, should only contain a-z, A_Z, 0-9, _ or .\nSee the output panel for a list.",,Invalid included file name dialog box message
INVALID_INCLUDEDFILE_NAME,Included file with invalid filename: '{0}',Included file with invalid filename: '{0}',,Invalid Included file name output message
Validate_InvalidFilename,'{0}' contains invalid filename characters,'{0}' contains invalid filename characters,,Rename message
InvalidIncludedFileName_Digit,'{0}' starts with a number. Various platforms do not support this,'{0}' starts with a number. Various platforms do not support this,,Invalid Included File starting with a digit
roomeditor_selectioncolour,Selection frame colour,Selection frame colour,,preference name for the selection frame colour for unlocked items in the room editor
roomeditor_selectionlockedcolour,Locked selection frame colour,Locked selection frame colour,,preference name for the selection frame colour for locked items in the room editor
roomeditor_propertiescolour,Properties frame colour,Properties frame colour,,preference name for the properties frame colour for unlocked items in the room editor
roomeditor_propertieslockedcolour,Locked properties frame colour,Locked properties frame colour,,preference name for the properties frame colour for locked items in the room editor
roomeditor_selectionboundscolour,Selection bounds colour,Selection bounds colour,,preference name for the selection bounds colour for unlocked items in the room editor
roomeditor_selectionboundslockedcolour,Locked selection bounds colour,Locked selection bounds colour,,preference name for the selection bounds colour for locked and unlocked items in the room editor
GridSettings_SnapToGridToolTip,Snap To Grid (${toggle_grid_snap}),Snap To Grid (${toggle_grid_snap}),,the tooltip for the snap to grid checkbox
PhysicsShapeEditor_FrameOf,of,of,,Frame x of y label
ResourcePrefs_DefaultSpriteOrigin,Default sprite origin,Default sprite origin,,Default sprite origin preference
ResourcePrefs_DefaultSpriteCollisionMaskKind,Default sprite collision mask kind,Default sprite collision mask kind,,Preferences / Sprite Editor / Default sprite collision mask kind
ListBoxEnum_eLVEDisplayMode_TreeView,Tree View,Tree View,,enum name
ListBoxEnum_eLVEDisplayMode_ListView,List View,List View,,enum name
ListBoxEnum_eLVEDisplayMode_Both,Both,Both,,enum name
ListBoxEnum_eOrigin_TopLeft,Top Left,Top Left,,enum name
ListBoxEnum_eOrigin_TopCentre,Top Centre,Top Centre,,enum name
ListBoxEnum_eOrigin_TopRight,Top Right,Top Right,,enum name
ListBoxEnum_eOrigin_MiddleLeft,Middle Left,Middle Left,,enum name
ListBoxEnum_eOrigin_MiddleCentre,Middle Centre,Middle Centre,,enum name
ListBoxEnum_eOrigin_MiddleRight,Middle Right,Middle Right,,enum name
ListBoxEnum_eOrigin_BottomLeft,Bottom Left,Bottom Left,,enum name
ListBoxEnum_eOrigin_BottomCentre,Bottom Centre,Bottom Centre,,enum name
ListBoxEnum_eOrigin_BottomRight,Bottom Right,Bottom Right,,enum name
RoomItem_RestoreNameUpdated,Attempting to restore item '{0}' name is already in use and has been updated to '{1}',Attempting to restore item '{0}' name is already in use and has been updated to '{1}',,console log message when restoring an item whose name has been taken by another instance
Extraction_Error,ERROR: Unable to extract '{0}' at '{1}',ERROR: Unable to extract '{0}' at '{1}',,Error message when gmz/yyz extraction fails
FontEditor_SampleText,Sample Text,Sample Text,,Font editor sample text
PhysicsShapeEditor_ToggleGrid,Toggle grid on or off.,Toggle grid on or off.,,Toggle grid tooltip
PhysicsShapeEditor_PlayAnimation,Play or pause the sprite animation.,Play or pause the sprite animation.,,Play or pause tooltip
PhysicsShapeEditor_CurrentFrameTooltip,Set the displayed sprite frame,Set the displayed sprite frame,,Current frame tooltip
PhysicsShapeEditor_SnapX,Set the horizontal grid alignment.,Set the horizontal grid alignment.,,Snap x tooltip
PhysicsShapeEditor_SnapY,Set the vertical grid alignment.,Set the vertical grid alignment.,,Snap y tooltip
GeneralSettings_ChainSoftness,Workspace chain rendering segment count,Workspace chain rendering segment count,,Chain softness preference
DnDModule_ToggleBreakpoint,Toggle Breakpoint,Toggle Breakpoint,,Toggle breakpoint on a DnD™ node
DnDModule_DisableNode,Disable,Disable,,Disable node output
DnDModule_EnableNode,Enable,Enable,,Enable node output
DnDModule_ToggleDisabled,Toggle Enabled,Toggle Enabled,,Toggle node output
DnDModule_NodeDisabled,(Disabled),(Disabled),,Node disabled story entry
DnDModule_DeleteAllBreakpoints,Delete All Breakpoints,Delete All Breakpoints,,Delete breakpoints on selected DnD™ nodes
DnDModule_DeleteNode,Delete,Delete,,DnD™ module delete selected
IDETooltip_LaptopMode_Title,Laptop Mode ({0}),Laptop Mode ({0}),,IDE toolbar laptop mode title
IDETooltip_LaptopMode_On,On,On,,On text
IDETooltip_LaptopMode_Off,Off,Off,,Off text
IDETooltip_LaptopMode_Description,"In Laptop Mode you can pan, scroll and zoom by moving the mouse over an area\nwhile holding ${LaptopLZoomKey} to zoom and Left Alt to pan and scroll.\nUse ${LaptopRHSKeys} for non-mouse interactions while Laptop Mode is enabled.","In Laptop Mode you can pan, scroll and zoom by moving the mouse over an area\nwhile holding ${LaptopLZoomKey} to zoom and Left Alt to pan and scroll.\nUse ${LaptopRHSKeys} for non-mouse interactions while Laptop Mode is enabled.",,IDE toolbar laptop mode description
MyAccount_Offline,Cannot access account management: User is offline,Cannot access account management: User is offline,,User is offline and trying to access My Account
UserOffline_NeedsInternet,Please make sure you have a working internet connection and try again.,Please make sure you have a working internet connection and try again.,,User is offline
MyAccount_WorkspaceTitle,My Account,My Account,,My account workspace title
RoomEditor_IgnoreItem,Export,Export,,checkbox for whether the item will be exported to the runner
StartPage_ProjectNotExistsTitle,Project Missing,Project Missing,,Project does not exist title
StartPage_ProjectNotExists,This project may have been moved or deleted.\nPlease verify the project location and try again.,This project may have been moved or deleted.\nPlease verify the project location and try again.,,Project does not exist
TileSet_Libraries,Libraries,Libraries,,the tile selection window libraries tab title
TileSet_Brushes,Brushes,Brushes,,the tile selection window brushes tab title
Validate_MaintainFileExtension,"Invalid name, cannot change extension from '{0}' to '{1}'.","Invalid name, cannot change extension from '{0}' to '{1}'.",,extension placeholder message
ObjectEditor_EditParent,Edit Parent,Edit Parent,,Edit parent object tooltip
ObjectEditor_EditMask,Edit Mask,Edit Mask,,Edit mask tooltip
StartPage_Web_RefreshTutorials,Refresh owned tutorials.,Refresh owned tutorials.,,Refresh tutorials tooltip
Tooltip_ResizeSprite,Resize Sprite,Resize Sprite,,Sprite resize button tooltip
Debugger_UnableToEvaluate,<unable to evaluate>,<unable to evaluate>,,Unable to evaluate expression in debugger
Debugger_ErrorMsg,An error has occurred in the game. See error message below.,An error has occurred in the game. See error message below.,,Debugger game error label
Debugger_TabTitle,Debugger,Debugger,,Debugger tab title
Debugger_Window_ResourceView,Resource View,Resource View,,Debugger resource view window title
Debugger_Window_SourceView,Source View,Source View,,Debugger source view window title
Debugger_Window_LocalsView,Locals,Locals,,Debugger locals window title
Debugger_Window_GlobalsView,Globals,Globals,,Debugger globals window title
Debugger_Window_WatchView,Watch,Watch,,Debugger watch window title
Debugger_Window_InstanceView,Instance,Instance,,Debugger instance window title
Debugger_Window_AllInstancesView,All Instances,All Instances,,Debugger all instances window title
Debugger_Window_SelectedInstanceView,Selected Instance,Selected Instance,,Debugger selected instance window title
Debugger_Window_SelectedInstanceView_Arg,Selected Instance {0},Selected Instance {0},,Debugger selected instance window title with argument
Debugger_Window_Callstack,Call Stack,Call Stack,,Debugger call stack window title
Debugger_Window_Surfaces,Surfaces & Textures,Surfaces & Textures,,Debugger surfaces window title
Debugger_Window_Graph,Graph,Graph,,Debugger graph window title
Debugger_Window_Profile,Profile,Profile,,Debugger profile window title
Debugger_Window_Buffers,Buffers,Buffers,,Debugger buffers window title
Debugger_Window_RenderState,Render States,Render States,,Debugger render states window title
Debugger_TimelineMoment,Moment {0},Moment {0},,Debugger timeline moment label
Debugger_Toltip_Run,Continue (${debugger_continue}),Continue (${debugger_continue}),,Debugger tooltip
Debugger_Toltip_Break,Break,Break,,Debugger tooltip
Debugger_Toltip_Restart,Restart game,Restart game,,Debugger tooltip
Debugger_Toltip_Stop,Close the game,Close the game,,Debugger tooltip
Debugger_Tooltip_Close,Discard the collected data and end the debugging session.,Discard the collected data and end the debugging session.,,Toltip lol
Debugger_Toltip_StepInto,Step into function call (${debugger_step_into}),Step into function call (${debugger_step_into}),,Debugger tooltip
Debugger_Toltip_StepOver,Step over function call (${debugger_step_over}),Step over function call (${debugger_step_over}),,Debugger tooltip
Debugger_Toltip_StepOut,Step out of function (${debugger_step_out}),Step out of function (${debugger_step_out}),,Debugger tooltip
Debugger_Toltip_Realtime,Enable real-time debugging,Enable real-time debugging,,Debugger tooltip
Debugger_SourceModified,Source Modified,Source Modified,,Debugger source modified window title
Debugger_SourceModified_Msg,The source code in {0} has been modified and cannot be debugged.,The source code in {0} has been modified and cannot be debugged.,,Debugger source modified window message
Debugger_MenuBar_Debugger,Debugger,Debugger,,Debugger menu bar
Debugger_RoomNoCode,This room has no creation code,This room has no creation code,,Debugger no code label
Debugger_ObjectNoCode,This object has no source code,This object has no source code,,Debugger no code label
Debugger_ScriptNoCode,This script has no source code,This script has no source code,,Debugger no code label
Debugger_TimeLineNoCode,This time line has no moments with source code,This time line has no moments with source code,,Debugger no code label
Debugger_ExtensionNoCode,This extension has no exported functions,This extension has no exported functions,,Debugger no code label
Debugger_CallStack_Name,Name,Name,,Debugger call stack name column
Debugger_Surfaces_Type,Type,Type,,Debugger surfaces type column
Debugger_Surfaces_Texture,Thumbnail,Thumbnail,,Debugger surfaces texture column
Debugger_Surfaces_Size,Size,Size,,Debugger surfaces size column
