Name,English,Translation,Restrictions,Comment
ResourceTree_ResourceDelete_IncludedFiles_Confirm,Are you sure you want to delete {0}?\nIncluded files/folders on disk will be deleted,{0} を削除しますか？\nディスク上のファイルやフォルダーも削除されます,,Resource tree folder delete confirmation label
ResourceTree_ResourceDelete_Events_Confirm,Are you sure you want to delete {0}?\nCollision events with deleted objects will also be deleted,{0} を削除しますか？\nオブジェクトが削除されると衝突イベントも削除されます,,Resource tree delete events confirmation label
ResourceTree_Rooms,Rooms,ルーム,,"Resource tree ""Rooms"" label"
ResourceTree_Scripts,Scripts,スクリプト,,"Resource tree ""Scripts"" label"
ResourceTree_Shaders,Shaders,シェーダー,,"Resource tree ""Shaders"" label"
ResourceTree_Sounds,Sounds,サウンド,,"Resource tree ""Sounds"" label"
ResourceTree_Sprites,Sprites,スプライト,,"Resource tree ""Sprites"" label"
ResourceTree_Tilesets,Tile Sets,タイル セット,,"Resource tree ""Tile Sets"" label"
ResourceTree_Timelines,Timelines,タイムライン,,"Resource tree ""Timelines"" label"
ResourceTree_Title,Resources,リソース,,Resource tree title
ResourceTree_ViewNameInUse,View Name Already In Use,このビュー名はすでに使用されています,,label to show view name is already in use when renaming
ResourceTree_CannotRenameDefaultView,Cannot rename Default View,デフォルト ビューの名前は変更できません,,label to show that you cannot rename default view
ResourceTree_LotsOfResourcesWarning,Do you want to open {0} resources for edit?,これらのリソース {0} を開いて編集しますか？,,label to warn user they are about to open a lot of resources
ResourceTree_LotsOfResourcesTitle,Opening Lots of Resources,開こうとしているリソースの数が非常に多いです,,title for warning dialog box
ResourceTree_CloneViewToolTip,Clone current view,現在のビューを複製します,,clone view tooltip
ResourceTree_AddViewToolTip,Add new view,ビューを新規追加します,,add new view tooltip
ResourceTree_DeleteViewToolTip,Delete current view,現在のビューを削除します,,delete view tooltip
ResourceTree_ExpandCollapseAllToolTip,Expand/Collapse All,すべて展開/格納,,expand/collapse all elements of the resource tree tooltip
ResourceTree_ExpandCollapseAll,Expand/Collapse All,すべて展開/格納,,expand/collapse all elements of the resource tree tooltip
ResourceTree_ExpandAll,Expand All,すべて展開,,Expand all elements of the resource tree
ResourceTree_CollapseAll,Collapse All,すべて格納,,Collapse all elements of the resource tree
RoomEditor_AddSubLayer,Add Sub Layer,サブ レイヤーの追加,,context sub menu heading for adding sub layers in the room editor layer view
RoomEditor_AddRootLayer,Add Layer,レイヤーの追加,,context sub menu heading for adding layers at the same level as the selected layer in the room editor layer view
RoomEditor_AllLayers,All,すべて,,Layers label next to the set all layers locked/visible checkboxes
RoomEditor_ConfirmDeleteInstances,Are you sure you want to delete the following items (Note: Instance creation code will be irrevocably lost): {0},次の項目を削除しますか (注: インスタンス生成時のコードも削除されます)？: {0},,Confirm delete instances
RoomEditor_ConfirmDeleteLayers,Are you sure you want to delete the following layers (Note: Instance creation code will be irrevocably lost): {0},次のレイヤーを削除しますか (注: インスタンス生成時のコードも削除されます)？: {0},,Confirm delete layers
RoomEditor_ConfirmDeleteParentItems,Attempting to delete items from a parent room (Note: Instance creation code will be irrevocably lost).\nDelete All: Delete matching items from child rooms\nKeep All: Keep all child room items\nKeep Changed: Keep child room items which have overridden the parent\nImmediate Children: {0},親ルームの項目を削除します (注: インスタンス生成時のコードも削除されます)。\nすべて削除: 子ルームの一致する項目をすべて削除します\nすべて保持: 子ルームのすべての項目を保持します\n変更を保持: 親をオーバーライドした項目のみ保持します\n該当する子ルーム: {0},,layer delete confirm dialog message explaining the child layer deletion options
RoomEditor_ConfirmDeleteParentLayers,Attempting to delete layers from a parent room (Note: Instance creation code will be irrevocably lost).\nDelete All: Delete matching layers from child rooms\nKeep All: Keep all child room layers\nKeep Changed: Keep child room layers which have overridden the parent\nImmediate Children: {0},親ルームのレイヤーを削除します (注: インスタンス生成時のコードも削除されます).\nすべて削除: 子ルームの一致するレイヤーをすべて削除します\nすべて保持: 子ルームのすべてのレイヤーを保持します\n変更を保持: 親をオーバーライドしたレイヤーのみ保持します\n該当する子ルーム: {0},,layer delete confirm dialog message explaining the child layer deletion options
RoomEditor_DeleteAllChildLayers,Delete All,すべて削除,,layer delete confirm dialog message for the delete all button
RoomEditor_DeleteLayer,Delete Layer,レイヤーの削除,,context menu option for deleting a layer
RoomEditor_RenameLayer,Rename Layer,レイヤー名の変更,,context menu option for renaming a layer
RoomEditor_DeleteSelectedLayer,Delete Selected Layers,選択されているレイヤーの削除,,tooltip for the delete selected layers button
RoomEditor_GraphicProperties,Graphic: {0},グラフィック: {0},,graphic properties window
RoomEditor_GridColour,Colour:,色:,,room editor toolbar grid colour select button caption
RoomEditor_GridSnapX,Snap X:,スナップ X:,,room editor toolbar grid horizontal snap numeric textbox caption
RoomEditor_GridSnapY,Snap Y:,スナップ Y:,,room editor toolbar grid vertical snap numeric textbox caption
RoomEditor_Inherit,Inherit,継承,,Inherit button caption
RoomEditor_InheritCode,Inherit Creation Code,生成時コードの継承,,Tooltip for the button which sets if this room inherits its creation code from the parent
RoomEditor_InheritEditorSettings,Inherit Editor Properties,エディター プロパティの継承,,Inherit button tool tip caption for editor settings
RoomEditor_InheritPhysicsSettings,Inherit Physics Properties,物理プロパティの継承,,Inherit button tool tip caption for physics settings
RoomEditor_InheritRoomSettings,Inherit Room Settings,ルーム設定の継承,,Inherit button tool tip caption for room settings
RoomEditor_InheritSubLayers,Inherit Sub Layers,サブ レイヤーの継承,,Context menu option for inheriting sub layers from the parent layer
RoomEditor_InheritView,Inherit View,ビューの継承,,inherit toggle button caption for a single view entry
RoomEditor_InheritViewSettings,Inherit View Properties,ビュー プロパティの継承,,Inherit button tool tip caption for view settings
RoomEditor_InheritVisibility,Inherit Layer Visibility,レイヤーの表示状態を継承,,Context menu entry for whether a layer should inherit visibility state
RoomEditor_InstanceProperties,Instance: {0},インスタンス: {0},,Instance properties window title
RoomEditor_KeepAllChildLayers,Keep All,すべて保持,,layer delete confirm dialog message for the keep all button
RoomEditor_KeepBrokenChildLayers,Keep Changed,変更を保持,,layer delete confirm dialog message for the keep changed button
RoomEditor_LayerProperties,{1} Layer Properties - {0},{1} レイヤーのプロパティ - {0},,Window title for the layer properties
RoomEditor_Layers,Layers - {0},レイヤー - {0},,Window heading for the room editor layers view
RoomEditor_NewAssetLayer,Create New Asset Layer,アセット レイヤーの新規作成,,Tool tip for the new asset layer button
RoomEditor_NewBackgroundLayer,Create New Background Layer,背景レイヤーの新規作成,,Tool tip for the new background layer button
RoomEditor_NewFolder,Create New Folder,フォルダーの新規作成,,Tool tip for the new folder button
RoomEditor_NewInstanceLayer,Create New Instance Layer,インスタンス レイヤーの新規作成,,Tool tip for the new instance layer button
RoomEditor_NewPathLayer,Create New Path Layer,パス レイヤーの新規作成,,Create new path layer tool tip for room editor
RoomEditor_NewTileLayer,Create New Tile Layer,タイル レイヤーの新規作成,,Tool tip for the new tile layer button
RoomEditor_NoParentItemToolTip,"{0} ({1}, {2})","{0} ({1}, {2})",,instance/graphic tooltip when there is no parent item
RoomEditor_ItemToolTip,"{0} ({1}, {2}) parent - {3}","{0} ({1}, {2}) 親 - {3}",,instance/graphic tooltip when there is no parent item
RoomEditor_RoomProperties,Properties - {0},プロパティ - {0},,Window title for room properties
RoomEditor_InstanceCreationOrder,Instance Creation Order - {0},インスタンスの生成順 - {0},,Window title for instance creation order
RoomEditorMenu_InstanceCreationOrder,Instance Creation Order,インスタンスの生成順,,menu entry for instance creation order window
RoomEditor_SelectedTileBrush,Brush:,ブラシ:,,Label for the currently selected tile editing brush
RoomEditor_SelectedTileTool,Tool:,ツール:,,Label for the currently selected tile editing tool
RoomEditor_EditingWindowMode,Editing Mode:,編集モード:,,Label for the TileSet macro page mode (selection or editing)
RoomEditor_TileWindow,Tiles - {0},タイル - {0},,Tile view/selection window title
RoomEditor_ZoomLevel,Zoom: {0}%,拡大率: {0}%,,label to display the current zoom level
RoomEditorMenu_LayerProperties,Layer Properties,レイヤー プロパティ,,context menu option for opening the layer properties window
RoomEditorMenu_LayerView,Layer View,レイヤー ビュー,,menu entry to open the layer view
RoomEditorMenu_ResetWindowLayout,Reset Windows On Current Desktop,現在表示しているウィンドウレイアウトのリセット,,menu entry to reset the room window layout bringing windows to the currently selected desktop
RoomEditorMenu_Room,Room,ルーム,,menu heading for the room editor
RoomEditorMenu_RoomProperties,Room Properties,ルーム プロパティ,,menu entry to open the room properties
RoomEditorMenu_Windows,Windows,ウィンドウ,,sub menu entry for the room editor windows
RoomEditorTileEditing_ClearSelection,Clear Selection,選択範囲の解除,,Tile editing menu entry heading for clear the current mask selection
RoomEditorTileEditing_CopySelection,Copy Selection,選択範囲のコピー,,Tile editing menu entry heading for copy the current mask selection
RoomEditorTileEditing_CutSelection,Cut Selection,選択範囲の切り取り,,Tile editing menu entry heading for cut the current mask selection
RoomEditorTileEditing_DeleteSelection,Delete Selection,選択範囲の削除,,Tile editing menu entry heading for delete the current mask selection
RoomEditorTileEditing_InvertSelection,Invert Selection,選択範囲の反転,,Tile editing menu entry heading for invert the current mask selection
RoomEditorTileEditing_Menu,Tile Editing,タイルの編集,,Tile editing sub menu entry heading
RoomEditorTileEditing_TileDisplayWindow,Tile Selection Window,選択されているウィンドウ タイル,,Tile editing menu entry heading for open the tile selection window
RoomEditorTool_AutoTile,Auto Tile (A),オート タイル (A),,tooltip for auto tile tool
RoomEditorTool_SelectTiles,Select Tiles (S),選択されているタイル (S),,tooltip for tile selection tool
RoomEditorTool_TileBrush,Paint Tiles,タイル ペイント,,Button tooltip for the tile brush tool
RoomEditorTool_TileEraser,Eraser (E),消しゴム (E),,tooltip for tile eraser tool
RoomEditorTool_TileFlip,Flip (Y),上下反転 (Y),,tooltip for flip tile brush
RoomEditorTool_TileInheritance,Show Tile Inheritance,タイルの継承関係を表示,,Tooltip message for the show tile inheritance button
RoomEditorTool_TileMirror,Mirror (X),左右反転 (X),,tooltip for mirror tile brush
RoomEditorTool_TilePaintInheritance,Edit Tile Inheritance (I),タイルの継承関係を編集 (I),,tooltip for inheritance tile brush
RoomEditorTool_TilePen,Pen (D),ペン (D),,tooltip for tile pen tool
RoomEditorTool_TileRotate,Rotate Tile (Z),タイルの回転 (Z),,tooltip for rotate tile brush
RoomEditorTool_TileFill,Fill (F),塗りつぶし (F),,tooltip for fill tile tool
RoomEditorTool_TileLine,Line (L),線 (L),,tooltip for line tile tool
RoomEditorTool_TileRect,Rectangle (R),矩形 (R),,tooltip for rectangle tile tool
RoomProperties_BackgroundColour,Room Colour,ルームの色,,room properties section heading for background colour
RoomProperties_ClearDisplayBuffer,Clear Display Buffer,表示バッファのクリア,,checkbox caption for clear display buffer option
RoomProperties_ClearView,Clear Viewport Background,ビューポートの背景をクリア,,checkbox caption for clear view background option
RoomProperties_Colour,Colour,色,,colour select box caption
RoomProperties_CreationCode,Creation Code,生成時のコード,,button caption for opening creation code
RoomProperties_CreationOrder,Instance Creation Order,インスタンスの生成順,, button caption for opening the instance creation order window
RoomProperties_EnablePhysics,Enable Physics,物理の有効化,,Checkbox caption for enabling physics
RoomProperties_EnableViews,Enable Viewports,ビューポートの有効化,,checkbox caption for enable views option
RoomProperties_GravityX,Gravity X,重力 X,,Numeric textbox caption for horizontal gravity
RoomProperties_GravityY,Gravity Y,重力 Y,,Numeric textbox caption for vertical gravity
RoomProperties_HBorder,Horizontal Border,水平枠,,numeric text box label for view for horizontal border
RoomProperties_Height,Height,高さ,,numeric textbox caption for room height
RoomProperties_HSpeed,Horizontal Speed,水平速度,,numeric text box label for view for horizontal speed
RoomProperties_Persistent,Persistent,永続性,,checkbox caption for persistent setting
RoomProperties_Physics,Room Physics,ルーム物理,,Room properties section heading for physics
RoomProperties_PixsToMeters,Pixels To Meters,ピクセルからメートルへ,,Numeric textbox caption for pixels to meters conversion
RoomProperties_Settings,Room Settings,ルーム設定,,room properties section heading for settings
RoomProperties_ShowColour,Draw Background Colour,背景色の描画,,checkbox caption for drawing background colour
RoomProperties_Speed,Speed,速度,,numeric textbox caption for room speed
RoomProperties_VBorder,Vertical Border,垂直枠,,numeric text box label for view for vertical border
RoomProperties_View,Viewport {0},ビューポート {0},,view instance heading in room properties
RoomProperties_ViewArea,Camera Properties,カメラ プロパティ,,group heading for room view area settings
RoomProperties_ViewFollowing,Object Following,オブジェクトの追従,,group heading for object following settings
RoomProperties_ViewH,Height,高さ,,numeric text box label for view or view port height
RoomProperties_Viewport,Viewport Properties,ビューポート プロパティ,,group heading for viewport settings
RoomProperties_Views,Viewports and Cameras,ビューポート & カメラ,,room properties section heading for views
RoomProperties_ViewVisible,Visible,表示,,checkbox caption for whether the view is visible from room start
RoomProperties_ViewW,Width,幅,,numeric text box label for view or view port width
RoomProperties_ViewX,X Pos,座標 X,,numeric text box label for view or view port x pos
RoomProperties_ViewY,Y Pos,座標 Y,,numeric text box label for view or view port y pos
RoomProperties_VSpeed,Vertical Speed,垂直速度,,numeric text box label for view for vertical speed
RoomProperties_Width,Width,幅,,numeric textbox caption for room width
Run_Menu_Clean,Clean,クリーン アップ,,"Run menu ""Clean"""
Run_Menu_CreateExecutable,Create Executable,実行ファイルの作成,,The Create Executable menu item
Run_Menu_RevealRemote,Show Remote Worker Installer,リモート ワーカーのインストーラーを表示,,Reveal worker menu item
Run_Menu_Run,Run,実行,,"Run menu ""Run"""
Run_Menu_RunDebug,Debug,デバッグ,,"Run menu ""Debug"""
remote_worker_error,Error,エラー,,Error Connecting to Remote Worker Dialog Title
remote_worker_error_connecting,Could not connect to Remote Worker.  Please check your setup and try again.,リモート ワーカーへ接続できませんでした。設定を確認して再度試してみてください。,,Error Connecting to Remote Worker Dialog Contents
remote_worker_error_no_name,Remote Worker was left blank.  Please name your Remote Worker and try again.,リモート ワーカーが空になっています。リモート メーカー名を指定して再度試してみてください。,,Error Connecting to Remote Worker Dialog Contents
remote_worker_error_invalid_name,'{0}' cannot be used as a name for the Remote Worker. Please enter a new name and try again.,'{0}' はリモート ワーカー名に使用できません。新しい名前を入力して再度試してみてください。,,Remote worker invalid name
Saving,Saving...,保存しています...,,Saving
SCM_Add_Path,Add Path,パスの追加,,Add a path to the SCM
SCM_Clone,Clone Repository,リポジトリのクローン,,Clone a Source Control Repository
SCM_Commit,Commit Changes,変更のコミット,,Commit local changes to Repository
SCM_Conflicts,Show Conflicts,競合の表示,,Show Conflicts within Repository
SCM_Create,Create Project Repository,プロジェクト リポジトリを作成,,Create a local Source Control Repository for this project
SCM_Delete_Path,Delete Path,パスの削除,,Delete a path from Source Control
SCM_History,View History,履歴を見る,,View Source Control Repository History
SCM_Import,Import Project into Repository,リポジトリへプロジェクトをインポート,,Import a Game Maker Project to a Source Control Repository
SCM_Menu,Source Control,ソース管理,,Source Control Menu title
SCM_Pull,Pull Changes,変更のプル,,Pull Changes from Source Control Repository
SCM_Push,Push Changes,変更のプッシュ,,Push Changes to Source Control Repository
SCM_Revert_All,Revert All,すべて打ち消し,,Revert all changes from Source Control
SCM_Revert_Path,Revert Path,パスの打ち消し,,Revert an item from Source Control
SCM_Revert_Revision,Revert To This Revision,このリビジョンまで打ち消す,,Revert to the selected revision in SCM
SCM_Conflict_Title,Source Control Conflicts,ソース管理の競合,,Source Control Conflicts window title
SCM_Conflict_Theirs,Use Theirs,Theirs を使用,,"Use ""Their"" version to resolve conflict"
SCM_Conflict_Merge,Merge,マージ,,Open Merge Tool
SCM_Conflict_MergeTool,Choose Merge Tool,Merge ツールの選択,,Choose which merge tool to use
SCM_Conflict_MergeTool_Path,Tool location,ツールの場所,,The Path to the Tool to use
SCM_Conflict_MergeTool_Options,Tool options,ツール オプション,,The Options to send to the Tool
SCM_Conflict_Mine,Use Mine,Ours を使用,,"Use ""Mine"" to resolve conflict"
SCM_Successful_Merge,Was the Merge operation successful?,マージ操作は成功しましたか？,,Wait for the Merge Tool to finish and ask the user if the operation has been a success
SearchReplace_Cancelled,Search Cancelled,検索がキャンセルされました,,Search and Replace - Search Cancelled
SearchReplace_CaseSensitive,Case Sensitive,大文字と小文字を区別する,,Search and Replace - Case Sensitive
SearchReplace_SearchStart,Searching for '{0}'...,'{0}' を検索しています...,,search started message
SearchReplace_ReplaceAllStart,Replacing '{0}' with '{1}','{0}' を '{1}' へ置換しています,,replace all start message
SearchReplace_Complete,Search Complete ({0} results),検索が完了しました ({0} 検索結果),,Search and Replace - Search Complete
SearchReplace_ContentHeader,Content,コンテンツ,,"Search & Replace - Output window ""content"" header"
SearchReplace_EndOfResults,"End of search results reached, should we loop?",検索結果の最後まで到達しました、ループしますか？,,"End of Search and Replace results, loop to beginning or end?"
SearchReplace_FindAll,Find All,すべて検索,,Search and Replace - Find All
SearchReplace_FindNext,Find Next,次を検索,,Search and Replace - Find Next
SearchReplace_FindPrevious,Find Previous,前を検索,,Search and Replace - Find Previous
SearchReplace_ItemHeader,Item,項目,,"Search & Replace - Output window ""item"" header"
SearchReplace_LineHeader,Line,行,,"Search & Replace - Output window ""line"" header"
SearchReplace_NoResults,No results were found.,検索結果が見つかりませんでした。,,Search and Replace - No results found.
SearchReplace_Replace,Replace:,置換:,,Search and Replace - Replace
SearchReplace_ReplaceAll,Replace All,すべて置換,,Search and Replace - Replace All
SearchReplace_ReplaceAllQuery,Are you sure you want to Replace All?\nThis will edit files on disk.,すべて置換しますか？\nこれにより、ディスク上のファイルが編集されます。,,Warn user that a Replace All will edit files on disk.
SearchReplace_ReplaceSelected,Replace,置換,,Search and Replace - Replace Selected
SearchReplace_Search,Search:,検索:,,Search and Replace - Search
SearchReplace_Title,Search & Replace,検索 & 置換,,Search and Replace title
SearchReplace_WholeWordOnly,Whole Word Only,単語単位で検索する,,Search and Replace - Whole Word Only
SearchReplace_MoreResults,There are more results available...,ほかにも検索結果があります...,,There are too many results to display
SearchReplace_StopSearch,Stop Search,検索の停止,,Search And Replace - stop search
SoundEditor_Attributes,Attributes:,属性:,,Sound Editor Attributes - for choosing uncompressed/streaming options
SoundEditor_AudioGroup,Audio Group:,オーディオ グループ:,,Sound Editor Audio Group labal
SoundEditor_BitRate,Bit Rate (kbps):,ビット レート (kbps):,,Sound Editor Target Bit Rate ( in kbps )
SoundEditor_Compressed_NotStreamed,Compressed - Not Streamed,圧縮 - ストリーミングなし,,Sound Editor Attribute - Compressed and Not Streamed
SoundEditor_Compressed_Streamed,Compressed - Streamed,圧縮 - ストリーミング,,Sound Editor Attribute - Compressed - Streamed
SoundEditor_CopyingSound,Copying Sound...,サウンドをコピーしています...,,SoundEditor - copying sound to project
SoundEditor_EditSound,Edit Sound,サウンドの編集,,Sound Editor Edit Sound Button
SoundEditor_Name,Name:,名前:,,Sound Editor Name label
SoundEditor_NoSound,No Sound has been loaded,サウンドが読み込まれていません,,SoundEditor - no sound has been loaded
SoundEditor_Open,Open,開く,,Sound Editor - Open new sound
SoundEditor_Quality,Quality:,クオリティ:,,Sound Editor Quality label
SoundEditor_SampleRate,Sample Rate:,サンプリング レート:,,Sound Editor Target Sample Rate
SoundEditor_SoundLoaded,Sound Loaded,サウンドが読み込まれました,,SoundEditor - Sound has been loaded
SoundEditor_TargetOptions,Target Options:,ターゲット オプション:,,"Sound Editor Target Options - for choosing sample rate, bit rate, etc..."
SoundEditor_Title,Sound: {0},サウンド: {0},,Title of SoundEditor window
SoundEditor_Uncompressed_NotStreamed,Uncompressed - Not Streamed,非圧縮 - ストリーミングなし,,Sound Editor Attribute - Uncompressed and Not Streamed
SoundEditor_UncompressOnLoad_NotStreamed,Uncompress on Load - Not Streamed,読み込み時に展開 - ストリーミングなし,,Sound Editor Attribute - Uncompress on Load - Not Streamed
SoundEditor_Volume,Volume:,音量:,,Sound Editor Volume label
SoundEditor_Output,Output:,出力:,,Sound Editor Output label
SoundEditor_NoDeviceWarningTitle,No Audio Device,オーディオ デバイスなし,,No audio device is available for previewing sounds warning dialog title
SoundEditor_NoDeviceWarning,No audio device is available for previewing sounds.,サウンドをプレビューするオーディオ デバイスがありません。,,No audio device is available for previewing sounds warning message
SoundEditor_StreamedAudioGroupWarning,Streaming sounds cannot be used in AudioGroups. Are you sure you want to set this to streaming? It will reset the AudioGroup back to Default.,ストリーミング サウンドは、オーディオ グループでは使用できません。オーディオ グループを Default へ戻してストリーミングに設定しますか？,,warning message for streamed sound in audio group
SoundMixer_Title,Sound Mixer,サウンド ミキサー,,Title of SoundMixer window
SoundMixer_ColumnVolume,Column Volume,音量カラム,,Column Volume Label
SoundMixer_UntitledGroup,Untitled Group,グループ名なし,,Label of Untitled Group
SoundMixer_TooManyGroupsTitle,Too Many Sound Mixer Groups,サウンド ミキサー グループが多すぎます,,There are Too Many Sound Mixer Groups title
SoundMixer_TooManyGroups,There are too many Sound Mixer Groups on this window. You could open another Sound Mixer or close unused groups in this window.,このウィンドウ内のサウンド ミキサー グループが多すぎます。使用していないグループを閉じるか、別のサウンド ミキサーを開いてください。,,There are too many Sound Mixer Groups on this window. You could open another Sound Mixer or close unused groups in this window.t
