Name,English,Translation,Restrictions,Comment
Project_DirectoryLost_Message,Project directory '{0}' is no longer available you will be unable to save progress until the directory is reconnected,Project directory '{0}' is no longer available you will be unable to save progress until the directory is reconnected,,message box contents when the project directory has been unavailable for a few minutes
Project_DirectoryLost_Title,Project Directory Unavailable,Project Directory Unavailable,,message box title when the project directory has been unavailable for a few minutes
Project_InheritedDirectoryLost_Message,Base project directory '{0}' is no longer available you will not receive notifications for changes,Base project directory '{0}' is no longer available you will not receive notifications for changes,,message box contents when the project directory has been unavailable for a few minutes
Project_InheritedDirectoryLost_Title,Base Project Directory Unavailable,Base Project Directory Unavailable,,message box title when the inherited project directory has been unavailable for a few minutes
Project_DirectoryReconnected_Message,"Project directory '{0}' has been reconnected. There may have been undetected changes, would you like to reload the project or save? \n\nWARNING: Save will only update the resources files that are currently held in memory, and therefore may not restore some deleted or edited files","Project directory '{0}' has been reconnected. There may have been undetected changes, would you like to reload the project or save? \n\nWARNING: Save will only update the resources files that are currently held in memory, and therefore may not restore some deleted or edited files",,message box contents when the project directory has been reconnected
Project_DirectoryReconnected_Title,Project Directory Reconnected,Project Directory Reconnected,,message box title when the project directory has been reconnected
Project_InheritedDirectoryReconnected_Message,"Base project directory '{0}' has been reconnected. There may have been undetected changes, would you like to reload the project?","Base project directory '{0}' has been reconnected. There may have been undetected changes, would you like to reload the project?",,message box contents when the project directory has been reconnected
Project_InheritedDirectoryReconnected_Title,Base Project Directory Reconnected,Base Project Directory Reconnected,,message box title when the inherited project directory has been reconnected
Project_LargeChanges_Message,"Project directory '{0}' has had a large number of changes detected. Would you like to reload the project, or save?\n\nWARNING: Save will only update the resources files that are currently held in memory, and therefore may not restore some deleted or edited files","Project directory '{0}' has had a large number of changes detected. Would you like to reload the project, or save?\n\nWARNING: Save will only update the resources files that are currently held in memory, and therefore may not restore some deleted or edited files",,message box contents when the project directory has been reconnected due to a buffer overflow
Project_LargeChanges_Title,Project Directory Modified,Project Directory Modified,,message box title when the project directory has been reconnected due to a buffer overflow
Project_InheritedLargeChanges_Message,"Base project directory '{0}' has been reconnected. There may have been undetected changes, would you like to reload the project?","Base project directory '{0}' has been reconnected. There may have been undetected changes, would you like to reload the project?",,message box contents when the project directory has been reconnected due to a buffer overflow
Project_InheritedLargeChanges_Title,Base Project Directory Modified,Base Project Directory Modified,,message box title when the inherited project directory has been reconnected due to a buffer overflow
ProjectReconnected_Reload,Reload,Reload,,button message for reloading the project
ProjectReconnected_Save,Save,Save,,button message for saving the project
Project_Changes_Message,"Changes detected in project directory '{0}'. Would you like to reload the resources, or save?\n\nWARNING: Save will only update the resources files that are currently held in memory, and therefore may not restore some deleted or edited files","Changes detected in project directory '{0}'. Would you like to reload the resources, or save?\n\nWARNING: Save will only update the resources files that are currently held in memory, and therefore may not restore some deleted or edited files",,message box contents when the project directory has detected changes
Project_Changes_Title,Project Directory Modified,Project Directory Modified,,message box title when the project directory has detected changes
Project_InheritedChanges_Message,"Changes detected in base project directory '{0}'. Would you like to reload the resources, or save?\n\nWARNING: Save will only update the resources files that are currently held in memory, and therefore may not restore some deleted or edited files","Changes detected in base project directory '{0}'. Would you like to reload the resources, or save?\n\nWARNING: Save will only update the resources files that are currently held in memory, and therefore may not restore some deleted or edited files",,message box contents when the project directory has detected changes
Project_InheritedChanges_Title,Project Directory Modified,Project Directory Modified,,message box title when the project directory has detected changes
Project_ProjFileChanged_Message,"The main project file '{0}' has changed. Would you like to reload the resources, or save?\n\nWARNING: Save will only update the resources files that are currently held in memory, and therefore may not restore some deleted or edited files","The main project file '{0}' has changed. Would you like to reload the resources, or save?\n\nWARNING: Save will only update the resources files that are currently held in memory, and therefore may not restore some deleted or edited files",,message box contents when the main project file has changed
Project_ProjFileChanged_Title,Project Modified,Project Modified,,message box title when the main project file has changed
Project_Deleted_Title,Project Deleted,Project Deleted,,message box title when a project has been deleted
Project_Deleted_Message,The project file '{0}' was deleted. Your project will now be closed.,The project file '{0}' was deleted. Your project will now be closed.,,Error message telling the user the project has been deleted
keystore_filename,Filename,Filename,,Keystore Filename
keystore_password,Password,Password,,Keystore Password
keystore_alias,Alias,Alias,,Keystore Alais
keystore_commonname,Common Name,Common Name,,Keystore Common Name
keystore_organisationalunit,Organisational Unit,Organisational Unit,,Keystore Organisational Unit
keystore_organisation,Organisation,Organisation,,Keystore Organisation
keystore_location,Location,Location,,Keystore Location
keystore_country,Country,Country,,Keystore Country
keystore_keyhash,Key Hash,Key Hash,,Keystore Key Hash
keystore_keyhash_sha1,Key Hash (SHA1),Key Hash (SHA1),,Keystore SHA1 Key Hash
keystore_show_keyhash,Show Key Hash,Show Key Hash,,Show Keystore Key Hash
keystore_generate_keyhash,Generate Keystore,Generate Keystore,,Generate Keystore Key Hash
android_checksdk,Check Android SDK,Check Android SDK,,Check Android SDK setup correctly
android_checkndk,Check Android NDK,Check Android NDK,,Check Android NDK setup correctly
android_issdkvalid,Is Android SDK Valid,Is Android SDK Valid,,Is Android SDK valid
android_sdkvalid,Android SDK Valid,Android SDK Valid,,Android SDK is valid
android_sdknotvalid,Android SDK Not Valid,Android SDK Not Valid,,Android SDK is not valid
android_sdknotvalid_nokeystore,Android SDK Not Valid - Missing Keystore,Android SDK Not Valid - Missing Keystore,,Android SDK Not Valid - Missing Keystore
android_sdknotvalid_invalidjdk,Android SDK Not Valid - Invalid JDK,Android SDK Not Valid - Invalid JDK,,Android SDK Not Valid - Invalid JDK
android_sdknotvalidated,Android SDK Not Validated,Android SDK Not Validated,,Android SDK is not validated
android_isndkvalid,Is Android NDK Valid,Is Android NDK Valid,,Is Android NDK valid
android_ndkvalid,Android NDK Valid,Android NDK Valid,,Android NDK is valid
android_ndknotvalid,Android NDK Not Valid,Android NDK Not Valid,,Android NDK is not valid
android_ndknotvalidated,Android NDK Not Validated,Android NDK Not Validated,,Android NDK is not validated
android_sdklocation,Android SDK Location,Android SDK Location,,Location of Android SDK
android_ndklocation,Android NDK Location,Android NDK Location,,Location of Android NDK
android_jdklocation,Java JDK Location,Java JDK Location,,Location of Java JDK
android_fullinstall,Always do full install of APK,Always do full install of APK,,Always do full install of APK
android_packageinstall,Install on package,Install on package,,Install on Package
android_maxheapsize,JDK maximum heap size (GB),JDK maximum heap size (GB),,Android build system max heap size
android_maxheapsize_tooltip,Gigabytes of RAM the Android build is allowed to use,Gigabytes of RAM the Android build is allowed to use,,Android build system max heap size tooltip
android_usemac,Use Mac for ADB connection,Use Mac for ADB connection,,Use Mac for ADB connection
android_macadbpath,ADB Path on Mac,ADB Path on Mac,,ADB Path on Mac
android_ipaddress,IP Address,IP Address,,IP Address
android_keystore,Android Keystore,Android Keystore,,Android Keystore
android_keystorepath,Path to Keystore,Path to Keystore,,Path to Keystore
android_keystore_warning1,IMPORTANT! Backup keystore files and info above!,IMPORTANT! Backup keystore files and info above!,,IMPORTANT! Backup keystore files and info above!
android_keystore_warning2,"If lost, you cannot submit app updates to Google Play or Amazon","If lost, you cannot submit app updates to Google Play or Amazon",,If lost you cannot submit app updates to Google Play or Amazon
android_package_name_invalid_title,Package name is invalid,Package name is invalid,,Android package name is invalid
android_package_name_invalid,Individual package name parts may only start with a letter and cannot be a reserved Java keyword,Individual package name parts may only start with a letter and cannot be a reserved Java keyword,,Android package name is invalid message and why
clearoutputwindowoncompile,Clear output window on compile start,Clear output window on compile start,,Option to clear the output window on each compile
openpackagesinexplorer,Show package in ${explorer} on build completion,Show package in ${explorer} on build completion,,Setting in Preferences General Compiling
Build_StopBeforeRun,Stop the current running project before running again?,Stop the current running project before running again?,,Stop the current running project before running again?
Build_NoDebugInYYC,"You cannot debug a project while using YYC, running using VM instead.","You cannot debug a project while using YYC, running using VM instead.",,Dialog shown when trying to debug a build whilst YYC is selected
Configuration_Problem,Configuration Problem,Configuration Problem,,There is a configuration problem with preferences or platform options
Build_AndroidSDK_NotFound,The path to the Android SDK cannot be found. Please ensure it is set correctly,The path to the Android SDK cannot be found. Please ensure it is set correctly,,The path to the Android SDK is wrong
Build_AndroidNDK_NotFound,The path to the Android NDK cannot be found. Please ensure it is set correctly,The path to the Android NDK cannot be found. Please ensure it is set correctly,,The path to the Android NDK is wrong
Build_AndroidJDK_NotFound,The path to the Java JDK cannot be found. Please ensure it is set correctly,The path to the Java JDK cannot be found. Please ensure it is set correctly,,The path to the Java JDK is wrong
Build_Android_NoArchs,No Architectures have been specified in the Android Options,No Architectures have been specified in the Android Options,,No Architectures were selected in the Android options
Build_Android_NoKeystore,No Keystore has been set in the Android Preferences,No Keystore has been set in the Android Preferences,,No Keystore has been set in the Android Preferences
Build_AmazonFire_NoKeystore,No Keystore has been set in the Amazon Fire Preferences,No Keystore has been set in the Amazon Fire Preferences,,No Keystore has been set in the Amazon Fire Preferences
Layer_Depth,Depth,Depth,,the layer depth property caption
stopbeforerun,Automatic response to restarting a running build,Automatic response to restarting a running build,,Automatic choice for stopping a current running build before running again.
maxparalleljobscompiling,Maximum parallel compile jobs,Maximum parallel compile jobs,,Maximum amount of jobs to use when compiling
debugyycwarning,Automatic response to warning when attempting to debug YYC,Automatic response to warning when attempting to debug YYC,,Preference to turn off the dialog warning the user that this run action will be completed in the VM not YYC
UseDefaultLicenseAgreement,Use Default Licence Agreement,Use Default Licence Agreement,,Use Default Licence Agreement
UseDefaultNSISScript,Use Default NSIS Script,Use Default NSIS Script,,Use Default NSIS Script
ObjectEditor_DefaultCodeComment,/// @description Insert description here\n// You can write your code in this editor,/// @description Insert description here\n// You can write your code in this editor,Do not translate @description and leave in /// and // at the start of each line,Object editor module default text for new events
ObjectEditor_DefaultEventComment,Default event content,Default event content,,Default Code Event Comment to use
ObjectEditor_ShowDefaultHelpPref,Add default event content,Add default event content,,Object editor module default text preference
ObjectEditor_InheritedEventAlpha,Inherited Events Alpha,Inherited Events Alpha,,object editor ghosted events alpha setting
ObjectEditor_EventFormatPref,Event label format (unchecked items are shown in the tooltip),Event label format (unchecked items are shown in the tooltip),,event label format preference title
ObjectEditor_EventOpenPref,Click to open Event method,Click to open Event method,,event open click preference
ObjectEditor_EventDeletePref,Automatic choice on event deletion,Automatic choice on event deletion,,Event deletion preference
ObjectEditor_EventDeleteMessage,Are you sure you want to delete this event and its contents?,Are you sure you want to delete this event and its contents?,,Are you sure about deleting the event message text
ListBoxEnum_eEventClickType_SingleClick,Single-Click,Single-Click,,single click enum
ListBoxEnum_eEventClickType_DoubleClick,Double-Click,Double-Click,,double click enum
EventLabelFormat_Name,Event Name,Event Name,,event label format name item
EventLabelFormat_Description,Event Description,Event Description,,event label format description item
EventLabelFormat_ParentObject,Parent Object,Parent Object,,event label format parent object item
DnD_ReservedTagName,The tag name {0} is reserved and cannot be used.,The tag name {0} is reserved and cannot be used.,,DnDGadget reserved tag name warning
DnD_ReservedTagName_Title,Reserved Tag Name,Reserved Tag Name,,DnDGadget reserved tag name warning message title
Room_InvalidDepthsImportedLog,Imported layer depths for room(s) '{0}' were not adequately spaced. Unless updated this will have undefined results in game.,Imported layer depths for room(s) '{0}' were not adequately spaced. Unless updated this will have undefined results in game.,,conversion log message where layer depths are invalid and have not been adjusted
Room_InvalidDepthsImportedMessage,Imported layer depths for rooms listed below are not adequately spaced. Do you want to redistribute depths? This may require updating scripts where depth values have been used. \nChoosing 'no' will maintain the user defined depths but will have undefined results in game.,Imported layer depths for rooms listed below are not adequately spaced. Do you want to redistribute depths? This may require updating scripts where depth values have been used. \nChoosing 'no' will maintain the user defined depths but will have undefined results in game.,, message when importing a project which has invalid layer depths
Room_AutoDepthUpdateMessage,"User defined layer depths are not adequately spaced. Do you want to redistribute depths? \nChoosing 'no' will maintain the user defined depths, but will have undefined results in game.","User defined layer depths are not adequately spaced. Do you want to redistribute depths? \nChoosing 'no' will maintain the user defined depths, but will have undefined results in game.",,the message when a user tries to put too many layers between their user defined layers such that we can't create unique depths.
Room_AutoDepthUpdateTitle,Layer Depth Error,Layer Depth Error,,message title when the user has given invalid layer depths
roomdefaultstep,Default layer depth spacing,Default layer depth spacing,,the preference label for auto depth layer spacing
room_autodepthchoice,Automatic response to updating layer depths,Automatic response to updating layer depths,,preference label for the auto depth confirmation dialog preference
DnDConvert_Warning,You are performing a one-way conversion from DnD™ to GameMaker Language. Do you want to continue?,You are performing a one-way conversion from DnD™ to GameMaker Language. Do you want to continue?,,Object editor convert dnd to script warning
DnDConvert_WarningTitle,Convert DnD™,Convert DnD™,,object editor dnd convert warning title
TimelineEditor_ConvertMerge,Merging the selected moments will result in conversion from DnD™ to GameMaker Language. Do you want to continue?,Merging the selected moments will result in conversion from DnD™ to GameMaker Language. Do you want to continue?,,Merge warning
TimelineDnD_ConvertOpposite,Opposite,Opposite,,Convert dnd or script to opposite type
Settings_DnDConvert,Automatic response to DnD™ conversion to GameMaker Language,Automatic response to DnD™ conversion to GameMaker Language,,DnD™ convert pref
Settings_DnDDeleteNode,Automatic response to DnD™ node deletion,Automatic response to DnD™ node deletion,,DnD™ deletion pref
DnDModule_DeleteNodeMsg,Are you sure you want to delete this DnD™ action?,Are you sure you want to delete this DnD™ action?,,DnD delete message
DnDModule_ConvertToScript,Convert to GML,Convert to GML,,DnD™ module convert to gml context menu
DnDModule_AddComment,Comment...,Comment...,,Add a comment to a DnD™ script
DnDModule_RemoveComment,Remove Comment,Remove Comment,,Remove a comment from a DnD™ script
DnDModule_RemoveComments,Remove Comments,Remove Comments,,Remove comments from a DnD™ script
DnDModule_Window,Window,Window,,Window submenu
dpi_percentage,% of native DPI,% of native DPI,,Slider to control percentage of DPI
dpi_raw,Raw DPI value,Raw DPI value,,Raw value of DPI to override with
DnDModule_ResetLayout,Reset Layout,Reset Layout,,DnD™ module reset layout context menu
ggs_support_lib,Support Library,Support Library,,Support Library
BackgroundLayer_AnimationFPS,Animation Speed:,Animation Speed:,,The caption for the background layer animation fps property
ListViewExplorer_None,None,None,,None resource
ListViewExplorer_GoBack,Back,Back,,Back item
ListView_Search,Search,Search,,ListView search label
ListViewExplorer_CancelSearch,Cancel,Cancel,,ListView cancel search label
DnDModule_ApplyToExplorer,Applies To...,Applies To...,,Apply to list view explorer title
DnDModule_ApplyTo_Self,Self,Self,,Apply to self caption
DnDModule_ApplyTo_Other,Other,Other,,Apply to other caption
DnDModule_ApplyTo_All,All,All,,Apply to all caption
DnDModule_ApplyTo_Expression,Expression,Expression,,Apply To expression label
RoomEditor_DockTab,Room Editor,Room Editor,,The default tab name for a tab created by the room editor
keystore_error,Error with Keystore,Error with Keystore,,Error with Keystore
keystore_invalid_alias,Invalid characters in alias,Invalid characters in alias,,Invalid characters in alias
keystore_invalid_password,Invalid characters in password,Invalid characters in password,,Invalid characters in password
keystore_invalid_commonname,Invalid characters in common name,Invalid characters in common name,,Invalid characters in common name
keystore_invalid_orgunit,Invalid characters in organisational unit,Invalid characters in organisational unit,,Invalid characters in organisational unit
keystore_invalid_org,Invalid characters in organisation,Invalid characters in organisation,,Invalid characters in organisation
keystore_invalid_location,Invalid characters in location,Invalid characters in location,,Invalid characters in location
keystore_invalid_country,Invalid characters in country,Invalid characters in country,,Invalid characters in country
keystore_small_pass,Password must be longer than 5 characters,Password must be longer than 5 characters,,Password must be longer than 5 characters
keystore_jdk_error,JDK not installed correctly at location entered in Android Platform Settings,JDK not installed correctly at location entered in Android Platform Settings,,JDK install error
keystore_show_error,Could not process Keystore; may be corrupt or have incorrect password,Could not process Keystore; may be corrupt or have incorrect password,,Keystore error during processing
keystore_small_alias,Alias password must be longer than 5 characters,Alias password must be longer than 5 characters,,Alias password must be longer than 5 characters
keystore_invalid_alias_password,Invalid characters in alias password,Invalid characters in alias password,,Invalid characters in alias password
GMXTextureGroup_BadId,The Texture Group for sprite '{0}' is invalid - setting to Default Texture Group instead,The Texture Group for sprite '{0}' is invalid - setting to Default Texture Group instead,,Error message on importing that a sprite texture group is wrong
ggs_enable_flurry,Enable Flurry Analytics,Enable Flurry Analytics,,Enable Flurry Analytics
ggs_enable_google_analytics,Enable Google Analytics,Enable Google Analytics,,Enable Google Analytics
ggs_google_analytics_id,Google Analytics ID,Google Analytics ID,,Google Analytics Id
ggs_flurry_id,Flurry Analytics ID,Flurry Analytics ID,,Flurry Analytics Id
ggs_advertising_type,Advertising Type,Advertising Type,,Advertising Type
ggs_use_test_ads,Use Test Ads,Use Test Ads,,Use Test Ads
ggs_enable_advertising,Enable Advertising,Enable Advertising,,Enable Advertising
ggs_advertising_key0,Key 0,Key 0,,Key 0
ggs_advertising_key1,Key 1,Key 1,,Key 1
ggs_advertising_key2,Key 2,Key 2,,Key 2
ggs_advertising_key3,Key 3,Key 3,,Key 3
ggs_advertising_key4,Key 4,Key 4,,Key 4
windowsuwp_package_arm,Package an ARM build,Package an ARM build,,Package an ARM build
windowsuwp_package_x86,Package an x86 build,Package an x86 build,,Package an x86 build
windowsuwp_package_x64,Package an x64 build,Package an x64 build,,Package an x64 build
win_uwp_package_default_type,Default package architecture,Default package architecture,,Win UWP Preference for package architecture
win_uwp_store_package_default_type,Automatic response to creating store package,Automatic response to creating store package,,Default response for creating store package - sits on same dialogue as package_default_type above
windows_package_remember,Remember Packaging Option?,Remember Packaging Option?,,Remember Packaging Option?
windows_package_nsis,Package as Installer,Package as Installer,,Package as Installer
windows_package_zip,Package as Zip,Package as Zip,,Package as Zip
windows_package_type,Package Type,Package Type,,Package Type
windows_package_default_type,Default packaging type,Default packaging type,,Default Packaging Type
html5_package_loose,Package as Loose Files,Package as Loose Files,,Package as Loose Files
html5_package_zip,Package as Zip,Package as Zip,,Package as Zip
html5_package_remember,Remember Packaging Option?,Remember Packaging Option?,,Remember Packaging Option?
html5_package_default_type,Default packaging type,Default packaging type,,Default Packaging Type
html5_default_webserver_port,Default Web Server Port,Default Web Server Port,,Default Webserver Port
html5_default_web_address,Default Web Server Address,Default Web Server Address,,Default Webserver Address
html5_default_allowed_ips,Default Web Server Allowed IPs,Default Web Server Allowed IPs,,Default Webserver Allowed IPs
ListBoxEnum_HTML5PackageChoice_HTML5Package_LooseFiles,Package as Loose Files,Package as Loose Files,,Package as Loose Files
ListBoxEnum_HTML5PackageChoice_HTML5Package_Zip,Package as Zip,Package as Zip,,Package as Zip
ListBoxEnum_HTML5PackageChoice_HTML5Package_Show,Show Dialog,Show Dialog,,Show Dialog
windows_uwp_package_upload,Package for Store Upload,Package for Store Upload,,Package for Store Upload
xbox_package_dev,Developer Package,Developer Package,,Normal Package type used during development
xbox_package_submission,Submission Package (/l),Submission Package (/l),,Package created for final submission to Microsoft
build_no_packaging_on_platform,Packages can not be built for the selected platform,Packages can not be built for the selected platform,,It is not possible to Create Application on this platform
build_no_packaging_on_platform_title,Error,Error,,Title for dialog box shown when trying to Create Application with Test platform selected
ListBoxEnum_WindowsPackageChoice_WindowsPackage_Show,Show Dialog,Show Dialog,,Show Dialog
ListBoxEnum_WindowsPackageChoice_WindowsPackage_Zip,Create Zip Archive,Create Zip Archive,,Create Zip Archive
ListBoxEnum_WindowsPackageChoice_WindowsPackage_Nsis,Create Nsis Installer,Create Nsis Installer,,Create Nsis Installer
ListBoxEnum_WindowsUWPPackageArchitectureChoice_WinUWPPackage_Show,Show Dialog,Show Dialog,,Show Dialog
